Name,City,State/Province,Zip_Code,Address,Phone,Website,Categories,Genres,Capacity,Age_Restriction,Rating,Description,Booking_Info,Facebook,Instagram,Upcoming_Events,Profile_URL,Normalized_Profile_URL,Source_Province_Search,Scraped_At
Whiski-Jack's Pub,West Kelowna,BC,V4T 1P7,"2442 Drought Road, West Kelowna, BC V4T 1P7",N/A,https://www.whiskijacks.com/,"Pub, Music Venue, Store","All Genres, Classic Rock, Rock",N/A,N/A,N/A,"West Kelowna's Favourite Neighbourhood Pub."" They host shows every Friday and Saturday night as well as an open jam on Sundays.",Requires Premium,https://www.facebook.com/whiskijackspub/,https://www.instagram.com/wjpinsandpints/,N/A,https://www.indieonthemove.com/venues/whiski-jacks-pub-west-kelowna-british-columbia,https://www.indieonthemove.com/venues/whiski-jacks-pub-west-kelowna-british-columbia,British Columbia,2026-05-03T13:42:53
The Coda,Victoria,BC,V8W 1J9,"751 View Street, Victoria, BC V8W 1J9",N/A,https://gotothecoda.com/calendar,Music Venue,All Genres,200,19+,N/A,"""Victoria's Live Music Venue."" Most shows take place Thursday-Saturday nights. Age requirement can vary.",Requires Premium,https://www.facebook.com/gotothecoda,https://www.instagram.com/gotothecoda/,N/A,https://www.indieonthemove.com/venues/the-coda-victoria-british-columbia,https://www.indieonthemove.com/venues/the-coda-victoria-british-columbia,British Columbia,2026-05-03T13:42:57
Red Bird Brewing,Kelowna,BC,V1Y 2K5,"1080 Richter Street, Kelowna, BC V1Y 2K5",N/A,https://www.redbirdbrewing.com/,"Music Venue, Brewery, Outdoor Performance Space","Acoustic, Alternative, Blues, Classic Rock, Country, Disco, Folk, Indie, Jazz, R&B, Rock, Roots Music, Singer-Songwriter, Soul",N/A,N/A,N/A,"""We are a microbrewery in downtown Kelowna, BC- passionate about excellent beer and great conversation."" Most shows take place on Thursday and Saturday nights. Performances take place outside during the warmer months. Age requirement can vary.",Requires Premium,https://www.facebook.com/redbirdbeer/,https://www.instagram.com/redbirdbeer/,Antonio Larosa; Elli Hart; Hotel Mira; Small Town Artillery; The Vidos; Aaron Wylder; Current Swell; Dan Tait; Cal Volpe; moondoggy,https://www.indieonthemove.com/venues/red-bird-brewing-kelowna-british-columbia,https://www.indieonthemove.com/venues/red-bird-brewing-kelowna-british-columbia,British Columbia,2026-05-03T13:43:02
Ladybug's Mew in Yellow Point,Ladysmith,BC,V9G 1G9,"13095 Prospect Drive, Ladysmith, BC V9G 1G9",N/A,https://ladybugsmewinyellowpoint.ca/,"Music Venue, Outdoor Performance Space, Seasonal","Acoustic, Americana, Bluegrass, Blues, Folk, Old Time, Roots Music, Singer-Songwriter, Traditional",60,N/A,N/A,"""Nestled in Yellow Point, discover a distinctive destination featuring a boutique farm store, garden nursery, and an intimate ticketed event stage. Our 12-acre organic farm proudly cultivates a rich variety of produce."" Shows are held a couple of times each month Sunday-Thursday, May-October.",Requires Premium,https://www.facebook.com/ladybugsmewinyellowpoint/,https://www.instagram.com/ladybugs_mew_in_yellowpoint/,N/A,https://www.indieonthemove.com/venues/ladybugs-mew-in-yellow-point-ladysmith-british-columbia,https://www.indieonthemove.com/venues/ladybugs-mew-in-yellow-point-ladysmith-british-columbia,British Columbia,2026-05-03T13:43:06
Unchagah Hall,Dawson Creek,BC,V1G 3Z3,"Sam Wilson Avenue, Dawson Creek, BC V1G 3Z3",N/A,N/A,Music Venue,"All Genres, Cabaret, Classical, Country, Dance, Folk, Jazz, Pop, Singer-Songwriter, Swing",600,N/A,N/A,Most events take place on the weekends. Concerts are sporadic in favor of theatrical productions.,Requires Premium,https://www.facebook.com/DCSSMusicalTheatre/,N/A,N/A,https://www.indieonthemove.com/venues/unchagah-hall-dawson-creek-british-columbia,https://www.indieonthemove.com/venues/unchagah-hall-dawson-creek-british-columbia,British Columbia,2026-05-03T13:43:11
The Rockin' Firkin,Kamloops,BC,V2B 1M9,"726 Sydney Avenue, Kamloops, BC V2B 1M9",N/A,N/A,"Bar, Music Venue","Classic Rock, Rock",150,19+,N/A,"""Your party destination on the North Shore."" Currently hosting an open Jam on Friday nights with other live music being infrequent.",Requires Premium,https://www.facebook.com/RockinFirkin/,N/A,N/A,https://www.indieonthemove.com/venues/rockin-firkin-kamloops-british-columbia,https://www.indieonthemove.com/venues/rockin-firkin-kamloops-british-columbia,British Columbia,2026-05-03T13:43:14
The Port Theatre,Nanaimo,BC,V9R 6Z4,"125 Front Street, Nanaimo, BC V9R 6Z4",N/A,https://www.porttheatre.com/,"Music Venue, Rental",All Genres,804,N/A,N/A,"""The Port Theatre is an 800-seat theatre on the breathtaking waterfront in downtown Nanaimo. The purpose of The Port Theatre Society is to stimulate and enhance artistic, cultural and economic activity of central Vancouver Island."" Concerts can be held any day/night of the week.",Requires Premium,https://www.facebook.com/porttheatre/,https://www.instagram.com/porttheatrenanaimo/,Big Awesome Entertainment; Highwaymen Show; Raffi; Raffi,https://www.indieonthemove.com/venues/the-port-theatre-nanaimo-british-columbia,https://www.indieonthemove.com/venues/the-port-theatre-nanaimo-british-columbia,British Columbia,2026-05-03T13:43:20
Sid Williams Theatre,Courtenay,BC,V9N 2J2,"442 Cliffe Avenue, Courtenay, BC V9N 2J2",N/A,https://www.sidwilliamstheatre.com/,"Music Venue, Rental",All Genres,520,N/A,N/A,"""The Sid Williams Theatre is operated by the Sid Williams Theatre Society, a registered charitable organization. The Society is responsible for the day-to-day running of the theatre, from artistic programming to custodial, from promotions to lighting design. The auditorium has just over 500 seats, including a 140-seat balcony and accessibility platform. The theatre lounge is fully licensed, offering refreshments and snacks prior to a performance and during intermission."" Live music and events can be held any day/night of the week.",Requires Premium,https://www.facebook.com/sidtheatre/,https://www.instagram.com/sidtheatre/,Highwaymen Show,https://www.indieonthemove.com/venues/sid-williams-theatre-courtenay-british-columbia,https://www.indieonthemove.com/venues/sid-williams-theatre-courtenay-british-columbia,British Columbia,2026-05-03T13:43:25
Tidemark Theatre,Campbell River,BC,V9W 2C8,"1220 Shoppers Row, Campbell River, BC V9W 2C8",N/A,https://tidemarktheatre.com/,"Music Venue, Rental",All Genres,467,N/A,N/A,"""The Tidemark Theatre has been operating as a community theatre and presenter since 1987, and is one of seven heritage sites identified by the City of Campbell River proposed to receive heritage designation. The primary activities undertaken by the Tidemark Theatre Society are focused on the presentation of performing arts, visual arts, media arts, as well as preservation and exhibition of heritage through the revitalization of the Tidemark Theatre."" Concerts can be held any night of the week.",Requires Premium,https://www.facebook.com/tidemarktheatre,https://www.instagram.com/tidemarktheatre/,Ethan Askey; Suzie Vinnick Music; Rob Lutes; Big Awesome Entertainment; Colin James; Colin James; Highwaymen Show,https://www.indieonthemove.com/venues/tidemark-theatre-campbell-river-british-columbia,https://www.indieonthemove.com/venues/tidemark-theatre-campbell-river-british-columbia,British Columbia,2026-05-03T13:43:31
BlueShore Financial Centre for the Performing Arts,North Vancouver,BC,V7J 3H5,"2055 Purcell Way, North Vancouver, BC V7J 3H5",N/A,https://www.capilanou.ca/student-services/community/blueshore-financial-centre-for-the-performing-arts/,"College/University, Music Venue","Classical, Folk, Jazz",372,N/A,N/A,"""Our theatre at North Vancouver's Capilano University presents jazz, folk & classical music & speakers."" Shows can be held any night of the week.",Requires Premium,https://www.facebook.com/BlueShoreatCapU,https://www.instagram.com/blueshoreatcapu/,Cyrille Brotto; Ablaye cissoko,https://www.indieonthemove.com/venues/blueshore-financial-centre-for-the-performing-arts-north-vancouver-british-columbia,https://www.indieonthemove.com/venues/blueshore-financial-centre-for-the-performing-arts-north-vancouver-british-columbia,British Columbia,2026-05-03T13:43:35
Centennial Theatre,North Vancouver,BC,V7M 3L1,"2300 Lonsdale Avenue, North Vancouver, BC V7M 3L1",N/A,https://www.nvrc.ca/centennial-theatre,"Music Venue, Rental",All Genres,658,N/A,N/A,"""The largest multi-purpose performing arts venue on Vancouver's North Shore."" Shows can be held any night of the week.",Requires Premium,https://www.facebook.com/CentennialTheatre/,N/A,Savonarola; Crisprr; Thomas Enhco,https://www.indieonthemove.com/venues/centennial-theatre-north-vancouver-british-columbia,https://www.indieonthemove.com/venues/centennial-theatre-north-vancouver-british-columbia,British Columbia,2026-05-03T13:43:40
Chilliwack Cultural Centre,Chilliwack,BC,V2P 4A6,"9201 Corbould Street, Chilliwack, BC V2P 4A6",N/A,https://www.chilliwackculturalcentre.ca/,"Music Venue, Rental",All Genres,580,N/A,N/A,"""Chilliwack Cultural Centre houses two unique performance theatres, an art gallery, music instruction studios, arts and crafts studios and meeting rooms."" Concerts can be held any night of the week.",Requires Premium,https://www.facebook.com/ChwkCulturalCtr/,https://www.instagram.com/chilliwackculturalcentre/,Colin James; PWR UP; Big Awesome Entertainment,https://www.indieonthemove.com/venues/chilliwack-cultural-centre-chilliwack-british-columbia,https://www.indieonthemove.com/venues/chilliwack-cultural-centre-chilliwack-british-columbia,British Columbia,2026-05-03T13:43:46
Clarke Theatre,Mission,BC,V2V 7B1,"33700 Prentis Avenue, Mission, BC V2V 7B1",N/A,https://www.mission.ca/clarke-theatre,"Music Venue, Rental",All Genres,702,N/A,N/A,"""The Clarke Theatre is a 702 balcony theatre with 496 seats on the main floor and 206 in the balcony."" Shows can be held any night of the week.",Requires Premium,https://www.facebook.com/ClarkeTheatre/,https://www.instagram.com/clarke_theatre/,N/A,https://www.indieonthemove.com/venues/clarke-theatre-mission-british-columbia,https://www.indieonthemove.com/venues/clarke-theatre-mission-british-columbia,British Columbia,2026-05-03T13:43:50
The Cultch,Vancouver,BC,V5L 2H6,"1895 Venables Street, Vancouver, BC V5L 2H6",N/A,https://thecultch.com/,"Music Venue, Rental",All Genres,350,N/A,N/A,"""For over 50 years in East Vancouver, The Cultch has offered programming in contemporary theatre, dance & music by local, national & international artists."" While most concerts take place on Friday and Saturday nights, they can be held any night of the week.",Requires Premium,https://www.facebook.com/TheCultch/,https://www.instagram.com/thecultch/,N/A,https://www.indieonthemove.com/venues/the-cultch-vancouver-british-columbia,https://www.indieonthemove.com/venues/the-cultch-vancouver-british-columbia,British Columbia,2026-05-03T13:43:56
Evergreen Cultural Centre,Coquitlam,BC,V3B 7Y3,"1205 Pinetree Way, Coquitlam, BC V3B 7Y3",N/A,https://evergreenculturalcentre.ca/,"Music Venue, Rental",All Genres,720,N/A,N/A,"""The Evergreen is the visual and performing arts hub of the Tri-Cities. Join us for a show from our season of performing arts, a fun event hosted by members of our community, or rent one of our theatre or studio spaces for an event of your own!"" Concerts and events can be held any day/night of the week.",Requires Premium,https://www.facebook.com/evergreenculturalcentre/,https://www.instagram.com/evergreenarts/,Maggie's Wake,https://www.indieonthemove.com/venues/evergreen-cultural-centre-coquitlam-british-columbia,https://www.indieonthemove.com/venues/evergreen-cultural-centre-coquitlam-british-columbia,British Columbia,2026-05-03T13:43:59
Maury Young Arts Centre,Whistler,BC,V8E 0X4,"4335 Blackcomb Way, Whistler, BC V8E 0X4",N/A,https://artswhistler.com/,"Music Venue, Rental",All Genres,238,N/A,N/A,"""Arts and culture in Whistler, BC. Celebrating local creativity in the Sea to Sky - art, music, class."" Most shows take place Thursday-Saturday nights.",Requires Premium,https://www.facebook.com/artswhistler/,https://www.instagram.com/artswhistler/,N/A,https://www.indieonthemove.com/venues/maury-young-arts-centre-whistler-british-columbia,https://www.indieonthemove.com/venues/maury-young-arts-centre-whistler-british-columbia,British Columbia,2026-05-03T13:44:04
Max Cameron Theatre,Powell River,BC,V8A 2L6,"5400 Marine Avenue, Powell River, BC V8A 2L6",N/A,https://www.maxcamerontheatre.ca/,"Music Venue, Rental",All Genres,402,N/A,N/A,"""Located on the campus of Brooks Secondary School, the 400-seat Max Cameron Theatre was commissioned by School District #47 as part of an expansion to the school that also included a digital media center, an acoustically engineered choral room, a film and video recording studio, and a dance and drama studio."" Concerts can be held any day/night of the week.",Requires Premium,https://www.facebook.com/maxcamerontheatre/,N/A,N/A,https://www.indieonthemove.com/venues/max-cameron-theatre-powell-river-british-columbia,https://www.indieonthemove.com/venues/max-cameron-theatre-powell-river-british-columbia,British Columbia,2026-05-03T13:44:09
Michael J. Fox Theatre,Burnaby,BC,V5J 0B2,"7373 MacPherson Avenue, Burnaby, BC V5J 0B2",N/A,https://michaeljfoxtheatre.ca/,"Music Venue, Rental",All Genres,613,N/A,N/A,"""Our theatre is proud to be a jewel in the arts community right here in Burnaby. The theatre hosts multicultural performances, dance, theatre, music and many other community events making it one of the busiest theatre venues in the lower mainland."" Concerts can be held any day/night of the week.",Requires Premium,https://www.facebook.com/michaeljfoxtheatre,https://www.instagram.com/mjftheatre/,N/A,https://www.indieonthemove.com/venues/michael-j-fox-theatre-burnaby-british-columbia,https://www.indieonthemove.com/venues/michael-j-fox-theatre-burnaby-british-columbia,British Columbia,2026-05-03T13:44:15
Pal Studio Theatre,Vancouver,BC,V6G 3L3,"581 Cardero Street, Vancouver, BC V6G 3L3",N/A,https://www.palvancouver.org/theatre,"Music Venue, Rental",All Genres,150,N/A,N/A,"""Located in Vancouver's Coal Harbour, our 150-seat studio is an amenity space for Performing Arts Lodge residents, a rental venue for performing arts companies and the city's only rooftop theatre!"" Concerts can be held any day/night of the week.",Requires Premium,https://www.facebook.com/palvancouver/,https://www.instagram.com/palvancouver/,N/A,https://www.indieonthemove.com/venues/pal-studio-theatre-vancouver-british-columbia,https://www.indieonthemove.com/venues/pal-studio-theatre-vancouver-british-columbia,British Columbia,2026-05-03T13:45:18
Shadbolt Centre for the Arts,Burnaby,BC,V5G 2J3,"6450 Deer Lake Avenue, Burnaby, BC V5G 2J3",N/A,https://www.burnaby.ca/recreation-and-arts/arts-and-culture-facilities/shadbolt-centre-for-the-arts,"Music Venue, Rental",All Genres,285,N/A,N/A,"""The Shadbolt Centre for the Arts is a stunning multi-use facility located in picturesque Deer Lake Park. The centre presents live performances, offers arts programs for all ages, produces community events and festivals, and its stunning architecture and flexible spaces makes it the perfect venue to host meetings, conferences and special occasions."" Concerts can be held any day/night of the week.",Requires Premium,https://www.facebook.com/ShadboltCentre,https://www.instagram.com/shadbolt_centre/,N/A,https://www.indieonthemove.com/venues/shadbolt-centre-for-the-arts-burnaby-british-columbia,https://www.indieonthemove.com/venues/shadbolt-centre-for-the-arts-burnaby-british-columbia,British Columbia,2026-05-03T13:45:22
UniTea Cafe & Lounge,Ashcroft,BC,V0K 1A0,"B - 605 Railway Avenue, Ashcroft, BC V0K 1A0",N/A,https://www.uniteacafetakeout.com/,"Music Venue, Cafe, Lounge, Open Mic","Acoustic, Americana, Bluegrass, Blues, Classical, Folk, Jazz, Roots Music, Singer-Songwriter, World",20,N/A,N/A,"""UniTea is more than just a tea room: it’s a place to learn, gather, play, relax or just connect with friends and neighbours...Monthly Entertainment Nights feature everything from classical, jazz to acoustic roots, blues and world music, poetry readings and open mic nights. UniTea’s walls are often used as an art gallery and from time to time there will be an artist in residence."" Most shows take place on Friday nights, occasionally on Saturday nights, but they are flexible.",Requires Premium,https://www.facebook.com/UniTeaInAshcroft,N/A,N/A,https://www.indieonthemove.com/venues/unitea-cafe-lounge-ashcroft-british-columbia,https://www.indieonthemove.com/venues/unitea-cafe-lounge-ashcroft-british-columbia,British Columbia,2026-05-03T13:45:27
Morrisey's Public House,Kamloops,BC,V0E 5N0,"3240 Village Way, Kamloops, BC V0E 5N0",N/A,https://www.sunpeaksgrand.com/dine/morriseys-public-house,"Music Venue, Restaurant, Pub, Seasonal",All Genres,100,19+,N/A,"""Located in the heart of the Upper Village at Sun Peaks Resort."" They host open mic on Thursday nights and shows on Saturday nights in the summer and winter months.",Requires Premium,https://www.facebook.com/morriseyspub/,https://www.instagram.com/morriseyspub/,N/A,https://www.indieonthemove.com/venues/morriseys-public-house-kamloops-british-columbia,https://www.indieonthemove.com/venues/morriseys-public-house-kamloops-british-columbia,British Columbia,2026-05-03T13:45:32
Pizza Pi,Kamloops,BC,V2C 2A5,"314 Victoria Street, Kamloops, BC V2C 2A5",N/A,https://pizzapikamloops.square.site/,"Music Venue, Restaurant, Open Mic",All Genres,N/A,N/A,N/A,"""At Pizza Pi, we love to have fun. That’s why we have live music every week and a rotating cast of touring musicians coming through town for your enjoyment. Come in and enjoy the entertainment over dinner, drinks or a late night snack!"" They host live music Monday-Saturday nights with Fridays being reserved for open mic. Monday-Thursday shows are typically no cover.",Requires Premium,https://www.facebook.com/PizzaPiKamloops/,https://www.instagram.com/pizzapiyka/,Dead Churches; Minot,https://www.indieonthemove.com/venues/pizza-pi-kamloops-british-columbia,https://www.indieonthemove.com/venues/pizza-pi-kamloops-british-columbia,British Columbia,2026-05-03T13:45:37
Privato Winery,Kamloops,BC,V2B 8N5,"5505 Westsyde Road, Kamloops, BC V2B 8N5",N/A,https://www.privato.ca/,"Music Venue, Winery, Outdoor Performance Space, Seasonal",All Genres,N/A,19+,N/A,"""A hidden gem in the heart of BC’s exciting new Thompson Valley wine region, Privato is a family owned boutique winery dedicated to the production of premium Burgundian styled wine."" Live music is held every other Friday night (ticketed) and every Sunday (free), June - September, in their garden.",Requires Premium,https://www.facebook.com/privatowine,https://www.instagram.com/privatowine/,N/A,https://www.indieonthemove.com/venues/privato-winery-kamloops-british-columbia,https://www.indieonthemove.com/venues/privato-winery-kamloops-british-columbia,British Columbia,2026-05-03T13:45:43
The Painted Ship,Vancouver,BC,V6K 2G6,"2884 W. Broadway, Vancouver, BC V6K 2G6",N/A,https://www.thepaintedship.ca/,"Music Venue, Bar, Restaurant",All Genres,N/A,N/A,N/A,"**Temporarily closed for spring cleaning.""Neighborhood bar, restaurant & music venue."" Most shows take place on Wednesday and Thursday nights as well as on Sunday afternoons.",Requires Premium,https://www.facebook.com/thepaintedship,https://www.instagram.com/thepaintedship/,N/A,https://www.indieonthemove.com/venues/the-painted-ship-vancouver-british-columbia,https://www.indieonthemove.com/venues/the-painted-ship-vancouver-british-columbia,British Columbia,2026-05-03T13:45:47
Frankie's Jazz Club,Vancouver,BC,V6B 2M4,"755 Beatty Street, Vancouver, BC V6B 2M4",N/A,https://www.frankiesjazzclub.ca/,Jazz & Blues,"Blues, Jazz",80,N/A,N/A,"""Frankie's Jazz is Vancouver's home to the city's best live Jazz and Blues."" Shows are held Thursday-Sunday nights. Minors are admitted with an adult until 10 PM.",Requires Premium,https://www.facebook.com/frankiesjazz/,https://www.instagram.com/frankiesjazz/,Rick Son; Sharon Minemoto; Angela Verbrugge; Rick Son; Mike DiRubbo; Mike DiRubbo; Sharon Minemoto,https://www.indieonthemove.com/venues/frankies-jazz-club-vancouver-british-columbia,https://www.indieonthemove.com/venues/frankies-jazz-club-vancouver-british-columbia,British Columbia,2026-05-03T13:45:52
Singletree Winery,Abbotsford,BC,V4X 1V4,"5782 Mt. Lehman Road, Abbotsford, BC V4X 1V4",N/A,https://singletreewinery.com/,"Music Venue, Winery, Outdoor Performance Space, Seasonal","All Genres, Acoustic",N/A,N/A,N/A,"""Family operated winery in beautiful Mt. Lehman, Abbotsford."" They host live music outside on two Fridays each month, June - early September.",Requires Premium,https://www.facebook.com/singletreewinery,https://www.instagram.com/singletreewine/,N/A,https://www.indieonthemove.com/venues/singletree-winery-abbotsford-british-columbia,https://www.indieonthemove.com/venues/singletree-winery-abbotsford-british-columbia,British Columbia,2026-05-03T13:45:57
Peak Cellars,Lake Country,BC,V4V 1G5,"2290 Goldie Road, Lake Country, BC V4V 1G5",N/A,https://peakcellars.com/,"Music Venue, Winery, Outdoor Performance Space, Seasonal","All Genres, Acoustic",N/A,N/A,N/A,"""Winery In Lake Country BC. Sustainable | 100% Estate Grown & Bottled."" They host live music on Wednesday nights and Sunday afternoons, mid May through the end of September.",Requires Premium,https://www.facebook.com/PeakCellarsWinery,https://www.instagram.com/peakcellars/,N/A,https://www.indieonthemove.com/venues/peak-cellars-lake-country-british-columbia,https://www.indieonthemove.com/venues/peak-cellars-lake-country-british-columbia,British Columbia,2026-05-03T13:46:01
At The Waldorf,Vancouver,BC,V5L 1S4,"1489 E. Hastings Street, Vancouver, BC V5L 1S4",N/A,https://www.atthewaldorf.com/,"Music Venue, Rental",All Genres,N/A,19+,N/A,"""At The Waldorf is a multi-venue complex featuring the infamous and widely popular Tiki Bar, The Hideaway, and Tabu. These historic rooms have hosted hundreds of incredible events, weddings and private performances."" Shows can be held any night of the week.",Requires Premium,https://www.facebook.com/atthewaldorf,https://www.instagram.com/atthewaldorf,N/A,https://www.indieonthemove.com/venues/at-the-waldorf-vancouver-british-columbia,https://www.indieonthemove.com/venues/at-the-waldorf-vancouver-british-columbia,British Columbia,2026-05-03T13:46:07
The Pearl on Granville,Vancouver,BC,V6Z 1L1,"881 Granville Street, Vancouver, BC V6Z 1L1",N/A,https://thepearlvancouver.com/,Music Venue,All Genres,700,19+,N/A,"""The Pearl is a multi purpose event and concert venue in the heart of downtown Vancouver. With its location and services, the space can be utilised for a variety of events including concerts, club nights, comedy, community events, corporate rentals, film shoots, daytime conferences and beyond."" Shows can be held any night of the week.",Requires Premium,https://www.facebook.com/the.pearl.vancouver/,https://www.instagram.com/the.pearl.vancouver/,I Speak Machine; Cabaret Voltaire; Gabriel Rutledge; Colette; Holy Fuck; Dead Churches; Chief State; Brown Horse; Ducks Ltd.; Yumi Zouma,https://www.indieonthemove.com/venues/the-pearl-on-granville-vancouver-british-columbia,https://www.indieonthemove.com/venues/the-pearl-on-granville-vancouver-british-columbia,British Columbia,2026-05-03T13:46:11
Mission Coffee House,Mission,BC,V2V 7B1,"33700 Prentis Avenue, Mission, BC V2V 7B1",N/A,N/A,Music Venue,"Acoustic, Americana, Blues, Country, Folk, Folk Rock, Roots Music, Singer-Songwriter, Traditional",702,N/A,N/A,"""Mission Coffee House brings joy to the community with intimate live music performances."" Shows are held in the Clarke Foundation Theatre on about one Saturday each month, September - early June.",Requires Premium,https://www.facebook.com/MissionCoffeeHouse/,https://www.instagram.com/missionconcertseries,N/A,https://www.indieonthemove.com/venues/mission-coffee-house-mission-british-collumbia,https://www.indieonthemove.com/venues/mission-coffee-house-mission-british-collumbia,British Columbia,2026-05-03T13:46:15
Murray Adaskin Salon at the Canadian Music Centre BC,Vancouver,BC,V6Z 1B7,"837 Davie Street, Vancouver, BC V6Z 1B7",N/A,https://bc.cmccanada.org/rentals,"Music Venue, Rental","Chamber, Classical, Jazz, World",40,N/A,N/A,"""An intimate music venue in the heart of downtown Vancouver."" Shows can be held any night of the week.",Requires Premium,https://www.facebook.com/CanadianMusicCentreBC,https://www.instagram.com/cmcnational/,N/A,https://www.indieonthemove.com/venues/murray-adaskin-salon-at-the-canadian-music-centre-bc-vancouver-british-columbia,https://www.indieonthemove.com/venues/murray-adaskin-salon-at-the-canadian-music-centre-bc-vancouver-british-columbia,British Columbia,2026-05-03T13:46:51
Trickster's Hideout,Squamish,BC,V8B 0C3,"38005 Cleveland Avenue, Squamish, BC V8B 0C3",N/A,https://trickstershideout.ca/,"Music Venue, Bar, Cafe",All Genres,N/A,N/A,N/A,"""Coffee + Cocktails + Community Space in Squamish."" They host shows on Friday and Saturday and on Sunday afternoons with open mic on the first Wednesday of each month.",Requires Premium,https://www.facebook.com/trickstershideout/,https://www.instagram.com/trickstershideout/,N/A,https://www.indieonthemove.com/venues/tricksters-hideout-squamish-british-columbia,https://www.indieonthemove.com/venues/tricksters-hideout-squamish-british-columbia,British Columbia,2026-05-03T13:46:55
