Name,City,State/Province,Zip_Code,Address,Phone,Website,Categories,Genres,Capacity,Age_Restriction,Rating,Description,Booking_Info,Facebook,Instagram,Upcoming_Events,Profile_URL,Normalized_Profile_URL,Source_Province_Search,Scraped_At
Junction Underground,Toronto,ON,M6P 1Z1,"2907 Dundas Street West, Toronto, ON M6P 1Z1",N/A,https://junctionunderground.ca/,Music Venue,All Genres,150,19+,N/A,"""The Junction Underground is Toronto’s newest west end venue. Built with locals in mind it is open for all to enjoy. Alex SenGupta (The Lakeview, Ding A Wing, High Park Cannabis Co.) and Drago Nagoda (High Park Cannabis Co.), who grew up in the area, hope to bring back some fun times in the former Junction City Music Hall."" Shows can take place Thursday-Sunday nights.",Requires Premium,https://www.facebook.com/JunctionUndergroundToronto/,https://www.instagram.com/junctionundergroundtoronto/,ALEX EXISTS; Skaface; Rat Grenade; Streets To Ourselves,https://www.indieonthemove.com/venues/junction-underground-toronto-ontario,https://www.indieonthemove.com/venues/junction-underground-toronto-ontario,,
Tapestry,Toronto,ON,M5T 2L6,"224 Augusta Avenue, Toronto, ON M5T 2L6",N/A,N/A,"Music Venue, Bar",All Genres,N/A,19+,N/A,"They host live music and/or DJs up to 6 nights a week, Tuesday-Sunday. They also have a monthly jam session called ""Tapestry Jam,"" in which they bring together 4 musician that remain anonymous to each other until the show.",Requires Premium,N/A,https://www.instagram.com/tapestry_to,Dinosaur Politics; redhed,https://www.indieonthemove.com/venues/tapestry-toronto-ontario,https://www.indieonthemove.com/venues/tapestry-toronto-ontario,,
Maxwell's Concerts and Events,Waterloo,ON,N2J 2V9,"35 University Avenue East, Waterloo, ON N2J 2V9",N/A,https://maxwellswaterloo.com/,"Music Venue, Rental",All Genres,700,N/A,N/A,"""Maxwell’s Concerts & Events is the most versatile event space in Waterloo Region. It’s located at 35 University Avenue East, seconds away from both Wilfrid Laurier University and University of Waterloo."" Shows can be held any night of the week. Age requirement can vary.",Requires Premium,https://www.facebook.com/maxwellswaterloo,https://www.instagram.com/maxwellswaterloo/,Michael Mathers - Eminem Tribute; Cam Kahin; Softcase; Born In The Eighties; Royal Tusk; John Shambles; Brother Elsey; Napalm Death; LANSDOWNE; Avalon Stone,https://www.indieonthemove.com/venues/maxwells-concerts-and-events-waterloo-ontario,https://www.indieonthemove.com/venues/maxwells-concerts-and-events-waterloo-ontario,,
Glenn Gould Studio,Toronto,ON,M5V 3G5,"250 Front Street West, Toronto, ON M5V 3G5",N/A,https://www.cbc.ca/glenngouldstudio/,"Music Venue, Rental","Classical, Jazz, Pop, Rock, World",337,N/A,N/A,"""We are a premier event rental, located in the heart of downtown Toronto at 250 Front Street West."" Shows can be held any night of the week.",Requires Premium,N/A,https://www.instagram.com/glenngouldcbc/,Alexis Baro,https://www.indieonthemove.com/venues/glenn-gould-studio-toronto-ontario,https://www.indieonthemove.com/venues/glenn-gould-studio-toronto-ontario,,
The Mod Club,Toronto,ON,M6G 1C4,"722 College Street, Toronto, ON M6G 1C4",N/A,https://www.themodclub.com/,Music Venue,All Genres,610,N/A,N/A,"Formerly The Axis Club Theatre. ""The Mod Club is located at the northwest corner of College and Crawford Streets in Toronto’s bustling Little Italy."" Shows can be held any night of the week. Age requirement can vary.",Requires Premium,N/A,https://www.instagram.com/themodclub/,Broadway Rave; Pile; mclusky; yung kai; yung kai; The Veldt; The Chameleons; Concrete Boys; Concrete Boys; Lexa Gates,https://www.indieonthemove.com/venues/the-mod-club-toronto-ontario,https://www.indieonthemove.com/venues/the-mod-club-toronto-ontario,,
The 27 Club,Ottawa,ON,K1N 5S7,"27 York Street, Ottawa, ON K1N 5S7",N/A,N/A,"Music Venue, Night Club",All Genres,N/A,19+,N/A,"""Live music acts, dance floor, themed nights - your downtown Ottawa nightclub."" They host events Monday - Saturday nights.",Requires Premium,https://www.facebook.com/the27clubottawa/,https://www.instagram.com/27club_ottawa/,Felix Cartal; Witchz; Magugu; Amos the Transparent; The Casualties; The Drowns; The OBGMs; The Effens; Lowertown; Bleeker,https://www.indieonthemove.com/venues/the-27-club-ottawa-ontario,https://www.indieonthemove.com/venues/the-27-club-ottawa-ontario,,
Crazy Horse Stonegrill Steakhouse & Saloon,Ottawa,ON,K2T 1G7,"115 Roland Michener Drive, Ottawa, ON K2T 1G7",N/A,https://www.thecrazyhorse.ca/,"Bar, Restaurant, Music Venue","All Genres, Alternative, Classic Rock, Country, Rock",N/A,19+,N/A,"""Ottawa's only Stonegrill Steakhouse -- experience 'lava rock' dining while enjoying the best talent from Nashville, Halifax, Toronto & Ottawa!!"" They host live music every Friday and Saturday night.",Requires Premium,https://www.facebook.com/CrazyHorseStonegrill/,https://www.instagram.com/barcrazyhorse/,N/A,https://www.indieonthemove.com/venues/crazy-horse-stonegrill-steakhouse-saloon-ottawa-ontario,https://www.indieonthemove.com/venues/crazy-horse-stonegrill-steakhouse-saloon-ottawa-ontario,,
Barnstorm,Finch,ON,K0C 1K0,"15328 Concession 3-4 Road, Finch, ON K0C 1K0",N/A,https://barnstorm.info/,Music Festival,All Genres,N/A,N/A,N/A,"**On hold in 2026.""Once a year, usually the first Saturday before Labour Day Weekend, our 150-year-old barn, the “Odditorium”, located at “The Sanctuary” in Finch, Ontario, comes to life with friends, locals, and music lovers at Barnstorm.""",Requires Premium,https://www.facebook.com/profile.php?id=100044267302581,N/A,N/A,https://www.indieonthemove.com/venues/barnstorm-finch-ontario,https://www.indieonthemove.com/venues/barnstorm-finch-ontario,,
The Barn,Alexandria,ON,K0C 1A0,"20990 Glen Robertson Road, Alexandria, ON K0C 1A0",N/A,N/A,Music Venue,"Blues, Chamber, Classic Rock, Country, Dance, Pop, Reggae, Rock",N/A,N/A,N/A,"""The Barn, originally constructed in 1908, is an awesome Live Music Venue located in Glengarry County."" They host Blues music on Tuesday nights and other concerts typically during the weekend.",Requires Premium,https://www.facebook.com/profile.php?id=100064917728137,N/A,N/A,https://www.indieonthemove.com/venues/the-barn-alexandria-ontario,https://www.indieonthemove.com/venues/the-barn-alexandria-ontario,,
Lavigne Tavern,Lavigne,ON,P0H 1R0,"10521 Ontario 64, Lavigne, ON P0H 1R0",N/A,https://lavignetavern.com/,"Music Venue, Pub, Open Mic","All Genres, Acoustic, Blues, Classic Rock, Country, Funk, Metal, R&B, Rock, Singer-Songwriter, Soft Rock, Soul, Top 40",80,19+,N/A,"""Home of the best Wings in West Nipissing, and the finest Pizza North of Toronto. The Lavigne Tavern also presents the very best in live entertainment. With artists coming from all over North America to perform at this Oasis in the North."" They host live music Thursday-Saturday nights and on Sunday afternoons with Thursdays being reserved for open mic.",Requires Premium,https://www.facebook.com/LavigneTavern/,https://www.instagram.com/lavigne_tavern/,N/A,https://www.indieonthemove.com/venues/lavigne-tavern-lavigne-ontario,https://www.indieonthemove.com/venues/lavigne-tavern-lavigne-ontario,,
Knox Hall,Greater Sudbury,ON,P3E 1B8,"73 Larch Street, Greater Sudbury, ON P3E 1B8",N/A,https://www.knox.vip/,"Rental, Music Venue",All Genres,324,N/A,N/A,"""This beautiful venue is located in Downtown Sudbury housed in a Historical Building constructed as a Church in 1927. With a seating capacity of 324 including VIP Balcony Seats, your experience will be like no other in Northern Ontario. The venue also includes an 80 Seat Lower Lounge with optional 125 standing room."" Shows can be held any night of the week.",Requires Premium,https://www.facebook.com/profile.php?id=100094239601038,https://www.instagram.com/knoxhallvip/,Kim Churchill; Mia Kelly; Jenn Grant; Aysanabee; Royal Wood; Fortunate Ones; Crystal Shawanda; At Dawn; Bobby Bazini; Mo Kenney,https://www.indieonthemove.com/venues/knox-hall-greater-sudbury-ontario,https://www.indieonthemove.com/venues/knox-hall-greater-sudbury-ontario,,
Jazz Sudbury,Greater Sudbury,ON,P3E 1C1,"96 Larch Street, Greater Sudbury, ON P3E 1C1",N/A,https://www.jazzsudbury.com/,Music Festival,Jazz,N/A,N/A,N/A,"""Since its inception in 2009, Jazz Sudbury Festival has become the premier musical event in the North. Jazz Sudbury showcases talented, award-winning artists and exposes the community to the diverse and captivating genre that is jazz."" The festival takes place in early September.",Requires Premium,https://www.facebook.com/JazzSudbury/,https://www.instagram.com/jazzsudburyofficial,N/A,https://www.indieonthemove.com/venues/jazz-sudbury-greater-sudbury-ontario,https://www.indieonthemove.com/venues/jazz-sudbury-greater-sudbury-ontario,,
The Grand,Greater Sudbury,ON,P3C 5B4,"28 Elgin Street, Greater Sudbury, ON P3C 5B4",N/A,N/A,Music Venue,All Genres,1000,19+,N/A,"""Built in 1909, the over 100 year old dual auditorium theatre, has been transformed into the home of Sudbury's nightlife."" Shows can be held any night of the week.",Requires Premium,https://www.facebook.com/Grandnightclub/,https://www.instagram.com/thegrandsudbury/,Strung Out; Tom Green; Alestorm; Twilight Force; greyhawk,https://www.indieonthemove.com/venues/the-grand-greater-sudbury-ontario,https://www.indieonthemove.com/venues/the-grand-greater-sudbury-ontario,,
The National,Greater Sudbury,ON,P3C 2X1,"477 Notre Dame Avenue, Greater Sudbury, ON P3C 2X1",N/A,https://nationaltavern.ca/,"Bar, Music Venue","Country, Honky Tonk",N/A,19+,N/A,"""A blast from the past, returning to its roots as the country bar we all know and love."" They host live music on the weekends [Saturdays and Sundays].",Requires Premium,https://www.facebook.com/profile.php?id=61555155915765,N/A,N/A,https://www.indieonthemove.com/venues/the-national-greater-sudbury-ontario,https://www.indieonthemove.com/venues/the-national-greater-sudbury-ontario,,
Lounge 390,Greater Sudbury,ON,P3B 1B1,"390 Elgin Street, Greater Sudbury, ON P3B 1B1",N/A,N/A,"Bar, Music Venue, Lounge","All Genres, Acoustic, Alternative, Classic Rock, Country, Indie, Rock, Singer-Songwriter",N/A,19+,N/A,"""The best bar and live music venue in the heart of Sudbury, Ontario."" They host live music Wednesday-Saturday nights.",Requires Premium,N/A,https://www.instagram.com/lounge_390/,Phantom Radio Chatter; Ace of Wands; Fortunate Losers; Sam Singer; Iron Kingdom; Skrizzly Adams,https://www.indieonthemove.com/venues/lounge-390-greater-sudbury-ontario,https://www.indieonthemove.com/venues/lounge-390-greater-sudbury-ontario,,
M.I.C. Canadian Eatery & Whisky Pub,Greater Sudbury,ON,P3A 5K4,"200 Falconbridge Road, Greater Sudbury, ON P3A 5K4",N/A,https://micrestaurant.ca/,"Bar, Restaurant, Music Venue, Outdoor Performance Space, Seasonal","Acoustic, Singer-Songwriter",N/A,N/A,N/A,"""Casual place decorated with photos of Canadian icons, offering a long whisky list & comfort food."" Shows take place outside on their patio every Wednesday, June - August.",Requires Premium,https://www.facebook.com/micsudbury/,https://www.instagram.com/m.i.c.canadianeatery/,N/A,https://www.indieonthemove.com/venues/mic-canadian-eatery-whisky-pub-greater-sudbury-ontario,https://www.indieonthemove.com/venues/mic-canadian-eatery-whisky-pub-greater-sudbury-ontario,,
Overtime Sports Bar and Grill,Greater Sudbury,ON,P3A 2T7,"941 Notre Dame Avenue, Greater Sudbury, ON P3A 2T7",N/A,https://www.sudburysportsbar.com/,"Bar, Restaurant, Music Venue","Acoustic, Singer-Songwriter",N/A,N/A,N/A,"""Sudbury's BEST eating & drinking experience! Great atmosphere, great service & homemade food."" They host live music on Friday nights only. The venue becomes 19+ later in the evening.",Requires Premium,https://www.facebook.com/overtimesportsbarsudbury/,N/A,N/A,https://www.indieonthemove.com/venues/overtime-sports-bar-and-grill-greater-sudbury-ontario,https://www.indieonthemove.com/venues/overtime-sports-bar-and-grill-greater-sudbury-ontario,,
About Live Music,Burk's Falls,ON,P0A 1C0,"60 Ontario Street Unit 1, Burk's Falls, ON P0A 1C0",N/A,https://www.aboutlivemusic.com/,Music Venue,"All Genres, Acoustic",N/A,N/A,N/A,"""About Live Music is an intimate music venue that provides a unique and personal experience for music lovers. The venue is designed to bring the audience in close, with a cozy and inviting atmosphere that encourages connection and engagement."" Shows are held at least once a month, Friday - Sunday.",Requires Premium,https://www.facebook.com/profile.php?id=100082537280964,https://www.instagram.com/aboutlivemusic/,N/A,https://www.indieonthemove.com/venues/about-live-music-burks-falls-ontario,https://www.indieonthemove.com/venues/about-live-music-burks-falls-ontario,,
Nickel City,Greater Sudbury,ON,P3C 1J2,"252 Hazel Street, Greater Sudbury, ON P3C 1J2",N/A,N/A,"Bar, Music Venue","Classic Rock, Country, Dance, Pop, Rock, Top 40",N/A,19+,N/A,"""Your favourite local sports bar, where you're only a stranger once. Come on down to enjoy pool, live music, and laughs all around."" They host shows on Friday and Saturday nights.",Requires Premium,https://www.facebook.com/nickelcityinn/,N/A,N/A,https://www.indieonthemove.com/venues/nickel-city-greater-sudbury-ontario,https://www.indieonthemove.com/venues/nickel-city-greater-sudbury-ontario,,
YES Theatre,Greater Sudbury,ON,P3E 3E7,"170 Shaughnessy Street, Greater Sudbury, ON P3E 3E7",N/A,https://yestheatre.com/,"Music Venue, Rental",All Genres,289,N/A,N/A,"""YES Theatre produces live theatrical events. Of which includes concerts, musicals, plays and more."" Shows can be held any night of the week in either of their two venues: Sudbury Theater Centre and The Refettorio. Age requirements are event dependent.",Requires Premium,https://www.facebook.com/YESTheatre/,https://www.instagram.com/yestheatresudbury/,N/A,https://www.indieonthemove.com/venues/yes-theatre-greater-sudbury-ontario,https://www.indieonthemove.com/venues/yes-theatre-greater-sudbury-ontario,,
The Night Owl,Greater Sudbury,ON,P3E 3N5,"158 Elgin Street, Greater Sudbury, ON P3E 3N5",N/A,https://www.nightowl.vip/,"Speakeasy, Music Venue, Jazz & Blues",Jazz,N/A,19+,N/A,"""The Downtown Sudbury Hideaway with a Certain Cachet."" They host live Jazz music every Thursday night.",Requires Premium,https://www.facebook.com/thenightowl.vip,https://www.instagram.com/nightowl.vip,N/A,https://www.indieonthemove.com/venues/the-night-owl-greater-sudbury-ontario,https://www.indieonthemove.com/venues/the-night-owl-greater-sudbury-ontario,,
NV Music Hall,Thunder Bay,ON,P7B 1A6,"228 Red River Road, Thunder Bay, ON P7B 1A6",N/A,https://www.nvmusichall.com/,"Music Venue, Bar",All Genres,N/A,18+,N/A,"""NV Music Hall is downtown Thunder Bay's premium entertainment spot."" Shows can be held any night of the week.",Requires Premium,https://www.facebook.com/NVMusicHall,N/A,N/A,https://www.indieonthemove.com/venues/nv-music-hall-thunder-bay-ontario,https://www.indieonthemove.com/venues/nv-music-hall-thunder-bay-ontario,,
Live From the Rock Folk Festival,Red Rock,ON,P0T 2P0,"42 Salls Street, Red Rock, ON P0T 2P0",N/A,https://livefromtherockfolkfestival.com/,Music Festival,"All Genres, Folk",N/A,N/A,N/A,"""The Live from the Rock Folk Festival is held every August in Red Rock, Ontario.""",Requires Premium,https://www.facebook.com/livefromtherockfolkfestival/,https://www.instagram.com/lftrfolkfest/,N/A,https://www.indieonthemove.com/venues/live-from-the-rock-folk-festival-red-rock-ontario,https://www.indieonthemove.com/venues/live-from-the-rock-folk-festival-red-rock-ontario,,
The Outpost,Thunder Bay,ON,P7B 5E1,"955 Oliver Road, Thunder Bay, ON P7B 5E1",N/A,https://lusu.ca/services-and-support/the-outpost/,"Night Club, Music Venue, Pub",All Genres,715,N/A,N/A,"""We are your friendly campus pub. Offering great food, amazing music, and a fantastic atmosphere to unwind after a long day of classes. With over 10,000 square feet of space, it’s one of the largest campus bars in Canada."" Shows can held any night of the week.",Requires Premium,https://www.facebook.com/TheOutpostCampusPub/,https://www.instagram.com/outpostpub/,N/A,https://www.indieonthemove.com/venues/the-outpost-thunder-bay-ontario,https://www.indieonthemove.com/venues/the-outpost-thunder-bay-ontario,,
UpFront Café,Belleville,ON,K8N 2Z9,"313 Front Street, Belleville, ON K8N 2Z9",N/A,https://upfrontcafe.ca/,"Music Venue, Cafe",All Genres,N/A,N/A,N/A,"""A licensed Cafe and Event space with live music weekly (mostly open jam on Thursdays, shows on Fridays and Saturdays, and Blues jam on Sundays).""",Requires Premium,https://www.facebook.com/UpFrontGallery,N/A,N/A,https://www.indieonthemove.com/venues/upfront-cafe-belleville-ontario,https://www.indieonthemove.com/venues/upfront-cafe-belleville-ontario,,
Mort's Pub,Ottawa,ON,K2H5Y7,"2011 Robertson Road, Ottawa, ON K2H5Y7",N/A,https://www.mortspub.com/,"Music Venue, Pub","Acoustic, Classic Rock, Dance, Pop, Rock, Top 40",N/A,N/A,N/A,This pub hosts an open jam on Thursday nights and shows on Saturday nights.,Requires Premium,https://www.facebook.com/profile.php?id=100054537816632,https://www.instagram.com/morts.pub,N/A,https://www.indieonthemove.com/venues/morts-pub-ottawa-ontario,https://www.indieonthemove.com/venues/morts-pub-ottawa-ontario,,
Highlands Music Festival,Palmer Rapids,ON,K0J 2E0,"Camp Walden, 38483 ON-28, Palmer Rapids, ON K0J 2E0",N/A,https://highlandsmusicfestival.ca/,Music Festival,"All Genres, Folk, Indie",N/A,N/A,N/A,"""Indie-Folk Festival at Summer Camp."" The festival takes place in late September.",Requires Premium,N/A,https://www.instagram.com/highlandsmusicfestival/,N/A,https://www.indieonthemove.com/venues/highlands-music-festival-palmer-rapids-ontario,https://www.indieonthemove.com/venues/highlands-music-festival-palmer-rapids-ontario,Ontario,2026-05-03T13:34:57
Duffy's Tavern,Toronto,ON,M6H 1N3,"1238 Bloor Street West, Toronto, ON M6H 1N3",N/A,http://duffystavern.ca/,"Music Venue, Bar, Restaurant",All Genres,200,19+,N/A,"""Toronto's best live music venue / neighbourhood bar/restaurant. Two live stages, all sporting events, 10 TV's, pool tables, table football, and lots more!"" Live music is held on Friday and Saturday nights.",Requires Premium,https://www.facebook.com/duffystoronto/,N/A,Ready to Strike; Nolan Hubbard; AloneKitty; Deer Fang; clay pigeon,https://www.indieonthemove.com/venues/duffys-tavern-toronto-ontario,https://www.indieonthemove.com/venues/duffys-tavern-toronto-ontario,Ontario,2026-05-03T13:35:02
Rum Runners,London,ON,N6A 1G7,"176 Dundas Street, London, ON N6A 1G7",N/A,N/A,Music Venue,All Genres,350,N/A,N/A,"""Rum Runners, which opened in 2005 is located within the walls of the London Music Hall. It has hosted acts such as the Arkells, illScarlett, & Cancer Bats."" Most shows take place Thursday-Sunday nights.",Requires Premium,https://www.facebook.com/rumrunnerslondon/,N/A,Destroyer; Strung Out; Limits of Approach; Alpha Wolf; Gideon; Mugshot; Resolve; Alpha Wolf; Lovers; Cat Clyde,https://www.indieonthemove.com/venues/rum-runners-london-ontario,https://www.indieonthemove.com/venues/rum-runners-london-ontario,Ontario,2026-05-03T13:35:39
Robo Lounge,Ottawa,ON,K1S 5Y2,"275 Carling Avenue, Ottawa, ON K1S 5Y2",N/A,https://www.barrobo.com/therobolounge/,"Music Venue, Bar, Cafe, Lounge","Acoustic, Jazz, Singer-Songwriter",150,19+,N/A,"""An intimate live music venue inside The Clemow."" Shows can be held any night of the week.",Requires Premium,https://www.facebook.com/profile.php?id=61574081203184,https://www.instagram.com/therobolounge,N/A,https://www.indieonthemove.com/venues/robo-lounge-ottawa-ontario,https://www.indieonthemove.com/venues/robo-lounge-ottawa-ontario,Ontario,2026-05-03T13:35:44
POP Montreal,Montreal,QC,H2V 4H2,"Montreal, QC H2V 4H2",N/A,https://popmontreal.com/,Music Festival,All Genres,N/A,N/A,5.00,"""POP Montreal International Music Festival is an annual not-for-proﬁt curated cultural event that champions independence in the arts by presenting emerging and celebrated artistic talents from around the world."" The festival takes place in late September/early October.",Requires Premium,https://www.facebook.com/popmontreal/,https://www.instagram.com/popmontreal/,N/A,https://www.indieonthemove.com/venues/pop-montreal-montreal-quebec,https://www.indieonthemove.com/venues/pop-montreal-montreal-quebec,Quebec,2026-05-03T13:36:12
Theatre Rialto,Montreal,QC,H2V 4H2,"5723 Avenue du Parc, Montreal, QC H2V 4H2",N/A,https://www.theatrerialto.ca/,"Music Venue, Rental",All Genres,1165,N/A,5.00,"""In March 2010, husband and wife duo Ezio Carosielli and Luisa Sassano purchased the iconic Rialto Theater located at 5723 ave. du Parc with the intention of restoring it to its original beauty and grandeur. The Rialto Theater is now an open, inclusive and multicultural center for performing arts that offers a platform for emerging local and international artists. It also serves as an event venue that hosts various private and corporate events including trade shows, conferences, product launches, holiday parties, galas, benefit concerts, fundraisers, cocktails, conventions, recognition & award shows, graduation balls, engagement parties, weddings, anniversaries, birthday celebrations, movie productions, photoshoots and more. Over 20,000 people walk through the Rialto's doors every year to take part in tours of the theater."" Live music can be held any night of the week.",Requires Premium,https://www.facebook.com/theatrerialto,https://www.instagram.com/theatrerialto/,Sal Da Vinci; Lee Harris; Davor Bozic; Tinariwen; K-Pop Infinity,https://www.indieonthemove.com/venues/theatre-rialto-montreal-quebec,https://www.indieonthemove.com/venues/theatre-rialto-montreal-quebec,Quebec,2026-05-03T13:36:16
Pub St-Alexandre,Quebec City,QC,G1R 1S3,"1087 Rue Saint-Jean, Quebec City, QC G1R 1S3",N/A,https://www.pubstalexandre.com/,"Music Venue, Restaurant, Pub","Blues, Folk, Jazz, Pop",N/A,N/A,N/A,"""In the heart of Old Quebec...a tradition."" The host live music 365 days a year.",Requires Premium,https://www.facebook.com/PubStAlexandre/,N/A,N/A,https://www.indieonthemove.com/venues/pub-st-alexandre-quebec-city-quebec,https://www.indieonthemove.com/venues/pub-st-alexandre-quebec-city-quebec,Quebec,2026-05-03T13:36:22
Barfly,Montreal,QC,H2W 1Y8,"4062 St. Laurent Boulevard, Montreal, QC H2W 1Y8",N/A,N/A,"Music Venue, Bar",All Genres,N/A,18+,N/A,"""Bar & Live Music Venue."" While most shows take place Thursday-Saturday nights, they can be held any night of the week.",Requires Premium,https://www.facebook.com/BarflyMtl/,https://www.instagram.com/barflylive/,Zach Bellas; Asia Ruby; Focused,https://www.indieonthemove.com/venues/barfly-montreal-quebec,https://www.indieonthemove.com/venues/barfly-montreal-quebec,Quebec,2026-05-03T13:36:27
Le Studio TD,Montreal,QC,H2X 2A3,"305 Sainte Catherine Street West, Montreal, QC H2X 2A3",N/A,https://lestudiotd.com/,Music Venue,All Genres,650,N/A,N/A,"""Performance hall in the heart of the Quartier des spectacles."" Shows can be held any night of the week.",Requires Premium,https://www.facebook.com/LeStudioTD/,https://www.instagram.com/lestudiotd/,Asim Azhar; Searows; Jordan Patterson; Jordan Patterson; Jimmy Moore; Jimmy Moore; Jimmy Moore; INJI; INJI; Statzz,https://www.indieonthemove.com/venues/le-studio-td-montreal-quebec,https://www.indieonthemove.com/venues/le-studio-td-montreal-quebec,Quebec,2026-05-03T13:36:32
The Wheel Club,Montreal,QC,H4B 2L7,"3373 Cavendish Boulevard, Montreal, QC H4B 2L7",N/A,https://www.wheelclubndg.com/,"Music Venue, Open Mic",All Genres,N/A,N/A,N/A,"""The Wheel Club is a historical, one-of-a-kind, not-for-profit club in Montreal's borough of NDG. Its mission is to promote community accessibility to artistic performance, and to ensure all genres of music and performance art are available to all ages within our culturally diverse and demographically rich community of NDG and Greater Montreal."" Most shows take place Friday - Sunday, but they are flexible. Mondays are reserved for open mic.",Requires Premium,https://www.facebook.com/wheelclubndg/,https://www.instagram.com/wheelclubndg,Cliff Stevens,https://www.indieonthemove.com/venues/the-wheel-club-montreal-quebec,https://www.indieonthemove.com/venues/the-wheel-club-montreal-quebec,Quebec,2026-05-03T13:36:36
Le Ministère,Montreal,QC,H2T 1R2,"4521 Boulevard Saint-Laurent, Montreal, QC H2T 1R2",N/A,https://leministere.ca/,"Music Venue, Rental",All Genres,288,N/A,N/A,"""Performance venue located in a heritage building on St-Laurent Boulevard."" Shows can be held any night of the week.",Requires Premium,https://www.facebook.com/leministere.ca/,https://www.instagram.com/leministere.ca/,Laurence Castera; Greenhouse Ensemble; Sessa; Kolumbo; Webster; Olie N.; Mélisande (QC); Jonathan Houde; Le Diable à Cinq; ANDRES ACOSTA,https://www.indieonthemove.com/venues/le-ministere-montreal-quebec,https://www.indieonthemove.com/venues/le-ministere-montreal-quebec,Quebec,2026-05-03T13:36:39
Bootlegger Cocktail Bar & Cuisine,Montreal,QC,H2X 2T6,"3481 Saint Laurent Boulevard, Montreal, QC H2X 2T6",N/A,https://barbootlegger.com/,"Bar, Music Venue, Jazz & Blues","DJ, Jazz",N/A,18+,N/A,"""Warm speakeasy-style cocktail bar for bespoke libations, elevated bites & live music."" They host live Jazz on Sunday nights. Most other nights are reserved for DJs.",Requires Premium,https://www.facebook.com/barbootlegger,N/A,N/A,https://www.indieonthemove.com/venues/bootlegger-cocktail-bar-cuisine-montreal-quebec,https://www.indieonthemove.com/venues/bootlegger-cocktail-bar-cuisine-montreal-quebec,Quebec,2026-05-03T13:36:43
